{
  "captured_at": "2026-09-11T12:00:00Z",
  "collector": "weather",
  "coverage": {
    "expected": 1,
    "missing": [],
    "present": 1
  },
  "envelope_version": "1",
  "errors": [],
  "scope": {
    "season": 2026,
    "week": 1
  },
  "signal_type": "venue_forecast_kickoff",
  "signals": [
    {
      "bands": {
        "precipitation_rate_in_hr": {
          "p10": 0.0,
          "p50": 0.0,
          "p90": 0.0
        },
        "temperature_f": {
          "p10": 61.51,
          "p50": 68.0,
          "p90": 74.49
        },
        "wind_speed_mph": {
          "p10": 8.38,
          "p50": 11.0,
          "p90": 13.62
        }
      },
      "environment": "outdoor",
      "feels_like_f": 67.0,
      "forecast_lead_hours": 53.0,
      "forecast_valid_at": "2026-09-13T17:00:00Z",
      "game_id": "2026_01_CHI_CAR",
      "humidity_pct": 62.0,
      "playability": {
        "ball_security_risk": {
          "inputs": {
            "precipitation_rate_in_hr": 0.0,
            "temperature_f": 68.0
          },
          "score": 0.0
        },
        "deep_pass_penalty": {
          "inputs": {
            "precipitation_rate_in_hr": 0.0,
            "wind_gust_mph": 18.0
          },
          "score": 0.4
        },
        "kicking_difficulty": {
          "inputs": {
            "temperature_f": 68.0,
            "wind_speed_mph": 11.0
          },
          "score": 0.3143
        }
      },
      "precipitation_probability": 0.1,
      "precipitation_rate_in_hr": 0.0,
      "precipitation_type": "none",
      "temperature_f": 68.0,
      "venue_id": "CAR00",
      "wind_direction_deg": 210,
      "wind_gust_mph": 18.0,
      "wind_speed_mph": 11.0
    }
  ],
  "upstream": {
    "adapter": "open-meteo",
    "fetched_at": "2026-09-11T12:00:00Z",
    "source_ref": null
  }
}
